<!--
Rafael Guiotto y Marc Guerra
14/10/24
Pr2 â€“ XSD - Receptes
-->
<xs:schema xmlns:xs="http://www.w3.org/2001/XMLSchema">
    <xs:element name="receptes">
        <xs:complexType>
            <xs:sequence>
                <xs:element name="recepta" maxOccurs="unbounded">
                    <xs:complexType>
                        <xs:sequence>
                            <xs:element name="nom" type="xs:string" />
                            <xs:element name="passos">
                                <xs:complexType>
                                    <xs:sequence>
                                        <xs:element name="pas" type="xs:string" maxOccurs="unbounded"/>
                                    </xs:sequence>
                                </xs:complexType>
                            </xs:element>
                        </xs:sequence>
                        <xs:attribute name="dificultat" type="xs:integer" />
                    </xs:complexType>
                </xs:element>
            </xs:sequence>
        </xs:complexType>
    </xs:element>
</xs:schema>